{"schemaVersion":1,"reviewer":"fixture-reviewer","viewport":{"width":390,"height":844},"scores":[{"category":"target-readability","score":4,"evidence":"fixture"},{"category":"hazard-recognition","score":4,"evidence":"fixture"},{"category":"checkpoint-prominence","score":4,"evidence":"fixture"},{"category":"theme-differentiation","score":4,"evidence":"fixture"},{"category":"transition-continuity","score":4,"evidence":"fixture"},{"category":"motion-weather-comfort","score":4,"evidence":"fixture"}]}
